{
  "task_id": "task-example-clean-template",
  "engine": "unity",
  "result": "ci_required",
  "checks_run": [
    "static_audit",
    "project_detection"
  ],
  "blocked_reason": "No Unity workspace is present in the template repository.",
  "evidence_paths": [
    ".claude-gamekit/project/docs/qa/reports/task-example-clean-template.md"
  ],
  "followups": [
    "Run the verification against a real Unity project."
  ]
}
